{
  "$schema": "https://json-schema.org/draft/2020-12/schema",
  "$id": "https://grandchallenge.ai/schemas/gcl-rc-chronology-cure-1.0.0.json",
  "title": "GCL-RC chronology cure",
  "type": "object",
  "additionalProperties": false,
  "required": [
    "schema_version",
    "record_id",
    "state",
    "subject",
    "pre_merge_evidence",
    "post_merge_comments",
    "retrospective_ratification",
    "preserved_boundaries"
  ],
  "properties": {
    "schema_version": {"const": "1.0.0"},
    "record_id": {"const": "GCL-RC-CHRONOLOGY-CURE-001"},
    "state": {"enum": ["ratification_pending", "ratified_pending_protected_merge", "protected_complete"]},
    "subject": {
      "type": "object",
      "additionalProperties": false,
      "required": ["repository", "pull_request", "reviewed_head", "merge_commit", "merged_at", "pre_merge_steward_authorization_present"],
      "properties": {
        "repository": {"const": "grandchallenge/gcl-standards"},
        "pull_request": {"const": 15},
        "reviewed_head": {"const": "f1a6ac165f8448dd949f7057c372dfc6cc151734"},
        "merge_commit": {"const": "afea7dd8e952998596fc54e215b6b1e2fcd48645"},
        "merged_at": {"const": "2026-08-02T23:35:59Z"},
        "pre_merge_steward_authorization_present": {"const": false}
      }
    },
    "pre_merge_evidence": {
      "type": "object",
      "additionalProperties": false,
      "required": ["non_author_approval", "standards_policy_run", "gcl_conformance_run", "artifact_blobs"],
      "properties": {
        "non_author_approval": {
          "type": "object",
          "additionalProperties": false,
          "required": ["review_id", "reviewer", "state", "submitted_at"],
          "properties": {
            "review_id": {"const": 4839993196},
            "reviewer": {"const": "jimsteeg"},
            "state": {"const": "APPROVED"},
            "submitted_at": {"const": "2026-08-02T23:34:55Z"}
          }
        },
        "standards_policy_run": {"const": 30772429041},
        "gcl_conformance_run": {"const": 30772429296},
        "artifact_blobs": {
          "type": "object",
          "additionalProperties": false,
          "required": ["standard", "schema", "template", "adoption_ledger", "decision"],
          "properties": {
            "standard": {"const": "2978dee21e7b7ee942756b39ea49572919cf552d"},
            "schema": {"const": "7bf9ba77df36d1646f123c174b0116c1552bb4cd"},
            "template": {"const": "6d0f041248d520715061bf1af8b1d97e27da0a43"},
            "adoption_ledger": {"const": "926e213f122da621e6472ef5f5fcf9fad214fcd2"},
            "decision": {"const": "3f5eed25efe6a9b593cc07d4125b35955dc9903f"}
          }
        }
      }
    },
    "post_merge_comments": {
      "type": "array",
      "minItems": 2,
      "maxItems": 2,
      "items": {
        "type": "object",
        "additionalProperties": false,
        "required": ["comment_id", "author", "created_at", "classification"],
        "properties": {
          "comment_id": {"enum": [5160929262, 5160945680]},
          "author": {"enum": ["jimsteeg", "fyremael"]},
          "created_at": {"enum": ["2026-08-02T23:47:40Z", "2026-08-02T23:52:26Z"]},
          "classification": {"const": "post_merge_prospective_wording_not_chronology_cure"}
        }
      }
    },
    "retrospective_ratification": {
      "type": "object",
      "additionalProperties": false,
      "required": ["required", "comment_id", "author", "recorded_at"],
      "properties": {
        "required": {"const": true},
        "comment_id": {"type": ["integer", "null"]},
        "author": {"type": ["string", "null"]},
        "recorded_at": {"type": ["string", "null"]}
      }
    },
    "preserved_boundaries": {
      "type": "object",
      "additionalProperties": false,
      "required": ["standard_status", "any_programme_conformant", "mathematical_claim_authorized", "deployment_claim_authorized", "revert_required"],
      "properties": {
        "standard_status": {"const": "candidate"},
        "any_programme_conformant": {"const": false},
        "mathematical_claim_authorized": {"const": false},
        "deployment_claim_authorized": {"const": false},
        "revert_required": {"const": false}
      }
    }
  }
}
