{
  "$schema": "../schemas/gcl_rc_chronology_cure.schema.json",
  "schema_version": "1.0.0",
  "record_id": "GCL-RC-CHRONOLOGY-CURE-001",
  "state": "ratified_pending_protected_merge",
  "subject": {
    "repository": "grandchallenge/gcl-standards",
    "pull_request": 15,
    "reviewed_head": "f1a6ac165f8448dd949f7057c372dfc6cc151734",
    "merge_commit": "afea7dd8e952998596fc54e215b6b1e2fcd48645",
    "merged_at": "2026-08-02T23:35:59Z",
    "pre_merge_steward_authorization_present": false
  },
  "pre_merge_evidence": {
    "non_author_approval": {
      "review_id": 4839993196,
      "reviewer": "jimsteeg",
      "state": "APPROVED",
      "submitted_at": "2026-08-02T23:34:55Z"
    },
    "standards_policy_run": 30772429041,
    "gcl_conformance_run": 30772429296,
    "artifact_blobs": {
      "standard": "2978dee21e7b7ee942756b39ea49572919cf552d",
      "schema": "7bf9ba77df36d1646f123c174b0116c1552bb4cd",
      "template": "6d0f041248d520715061bf1af8b1d97e27da0a43",
      "adoption_ledger": "926e213f122da621e6472ef5f5fcf9fad214fcd2",
      "decision": "3f5eed25efe6a9b593cc07d4125b35955dc9903f"
    }
  },
  "post_merge_comments": [
    {
      "comment_id": 5160929262,
      "author": "jimsteeg",
      "created_at": "2026-08-02T23:47:40Z",
      "classification": "post_merge_prospective_wording_not_chronology_cure"
    },
    {
      "comment_id": 5160945680,
      "author": "fyremael",
      "created_at": "2026-08-02T23:52:26Z",
      "classification": "post_merge_prospective_wording_not_chronology_cure"
    }
  ],
  "retrospective_ratification": {
    "required": true,
    "comment_id": 5161001756,
    "author": "fyremael",
    "recorded_at": "2026-08-03T00:07:12Z"
  },
  "preserved_boundaries": {
    "standard_status": "candidate",
    "any_programme_conformant": false,
    "mathematical_claim_authorized": false,
    "deployment_claim_authorized": false,
    "revert_required": false
  }
}
